{
  "schema_version": "1",
  "case_id": "031-matclaw-cips-active-distillation",
  "state": "benchmark_valid",
  "evaluator_bundle_sha256": "ec4b78a8dbb33fe21a06b5f0246160a21145fdee9a7cc4934f42991e1c787a8f",
  "bundle_sha256": "ec4b78a8dbb33fe21a06b5f0246160a21145fdee9a7cc4934f42991e1c787a8f",
  "files": [
    {
      "path": "profiles/formal.yaml",
      "sha256": "1e55494857b0ac733220cf3b05b5edd8fa8d4307543d30c8faddfe18ea311713"
    },
    {
      "path": "profiles/platform.yaml",
      "sha256": "127cefef0ad6bf6c910840b5ef8e91deaf4bb0970a1d50d3fe7116507714abfe"
    },
    {
      "path": "profiles/resource.yaml",
      "sha256": "c6ea71c810f2a9d3314501a8fc832925a800b5d221b8afc96ae39a80e9ae7f80"
    },
    {
      "path": "profiles/smoke.yaml",
      "sha256": "a3de59130196daa20c98c53954b88359847f59b2d4b64775aa524907b75c92d7"
    },
    {
      "path": "reference/compute-runtime.lock.json",
      "sha256": "b81b2f9203d1c2a7f583013aa43a291a6e6da39dfdafb3092425212b82da4bd2"
    },
    {
      "path": "reference/generate_reference.py",
      "sha256": "7857f9a06f271562370d665415f842d44264edb12d3fa3dae59be6be5c80d952"
    },
    {
      "path": "reference/original_reference.json",
      "sha256": "700436888940bd693f77ca2581ab5d4f31da1f77f8aaa54689eb927fd8953ff6"
    },
    {
      "path": "reference/source.lock.json",
      "sha256": "7407d23bfdb6ad90667b5ecf836a6845bbbbe0bffa949f6090639325700d96e1"
    },
    {
      "path": "solution/active_contract.py",
      "sha256": "2f275fc128cfdb3ee340f7a81d65f530737439d149d14d2192ba22060a023fdc"
    },
    {
      "path": "solution/active_utils.py",
      "sha256": "f2f2e60fa82e3e371da5a6b38a6227e00e4ae09eb12d30c0775d5b977aa0d4b1"
    },
    {
      "path": "solution/alt_distillation.py",
      "sha256": "1da53469bc058c9a4cd4f2ab36f3b1d7f817f7d1c35aa7e0f68f41cfcfd2abd6"
    },
    {
      "path": "solution/run_distillation.py",
      "sha256": "f284ca08f2cba4f3d12edadfbd791a8110603c712169b0377455bda1589a3c49"
    },
    {
      "path": "solution/run_profiles.json",
      "sha256": "fadeba4f1a9a34300c1aa08247e71678bd9cf65dd0bbba8f0b423bd08bd49738"
    },
    {
      "path": "solution/solve.sh",
      "sha256": "c1c42695483c760e9937c22daa06293f720ccd6270d7abcc0e3273d6ed5804e5"
    },
    {
      "path": "solution/solve_alt.sh",
      "sha256": "32a4678e9a349490f83589a7265467b8dd794d22eef12b12fd1eec510d9e0679"
    },
    {
      "path": "tests/README.md",
      "sha256": "60563bfe31188106466828de7790e6a7c42fa348892de48d4da6671a8f950f4c"
    },
    {
      "path": "tests/test.sh",
      "sha256": "32fc74667439f10b7489dd659c77a092cabef8845606b522d6d68345cb0e9538"
    },
    {
      "path": "tests/test_active_contract.py",
      "sha256": "0421c8cff917f50992c84bbacbe6cd55cca71be97d7433f307aafe14aaacffda"
    },
    {
      "path": "tests/test_analysis.py",
      "sha256": "a3b0ed5e7b0916d29601e80acdd44c068b31ab5257da7fbab642a5b32e4ecba8"
    },
    {
      "path": "tests/test_outputs.py",
      "sha256": "8a8e60d9c6afa52e8edc26311a546a52b43f5e7ef647f300a8faa45f197a5bb9"
    },
    {
      "path": "tests/verifier.py",
      "sha256": "dcfdfa97d614a44218bee1089b5468672a464d40f4d617ce679afb392d9706d0"
    }
  ]
}
