{
  "schema_version": "1",
  "case_id": "033-matclaw-cips-domain-wall-search",
  "state": "constructed",
  "evaluator_bundle_sha256": "8db9f54795dde090ea86d868eebbc1231e1d623daac1f3765a66f51d70e13b5c",
  "bundle_sha256": "8db9f54795dde090ea86d868eebbc1231e1d623daac1f3765a66f51d70e13b5c",
  "files": [
    {
      "path": "profiles/formal.yaml",
      "sha256": "b365f8b0a2108a7dd482d9fa57d68ea7f152a65f81a0997ae4803fdc6a25c99b"
    },
    {
      "path": "profiles/platform.yaml",
      "sha256": "a175bc7b4e2d43da70264b512111f453ad640f7670e2c932fda2834311a41e5e"
    },
    {
      "path": "profiles/resource.yaml",
      "sha256": "091683538e368ebe476f63923a9fa2cd9b607ea78845c9b65b8a132fa6a57faa"
    },
    {
      "path": "profiles/smoke.yaml",
      "sha256": "c62690f243ba5c3e7e6395d4d23053af1eb0c7987cd8d19e12278bdf0fa84039"
    },
    {
      "path": "reference/compute-runtime.lock.json",
      "sha256": "10048129b46f9a83af8929083aab8e8b3919b68163e7b4b5d7d6ef3d6acd4ac7"
    },
    {
      "path": "reference/generate_reference.py",
      "sha256": "7857f9a06f271562370d665415f842d44264edb12d3fa3dae59be6be5c80d952"
    },
    {
      "path": "reference/original_reference.json",
      "sha256": "b745f8650db927c0da14ea8b0f074142ffdb22012e927fe225ed952f08034491"
    },
    {
      "path": "reference/source.lock.json",
      "sha256": "b33d4bf6f5c561e943b36518e3edb727af1e34efe0dbbedd25deaebf1a3be69d"
    },
    {
      "path": "solution/alt_search.py",
      "sha256": "81788f02d8ca1d1a30b55a87c11cb69f0da3f3e65bea2c205fe12a68bb0345ba"
    },
    {
      "path": "solution/domino_metrics.py",
      "sha256": "c66ae1237885488ad555b608341c7e5c3a33a220bdb56925e0bf3f94c980c3c2"
    },
    {
      "path": "solution/field_calculator.py",
      "sha256": "c27a07bea6a13873e8c17ceefbedb9222e776cc0f9d05774d4736f96b071d326"
    },
    {
      "path": "solution/run_profiles.json",
      "sha256": "b22c39c9c5ddf7480b1959750e0e93e2a42d6db577907bf1976de8a5d9bbdd31"
    },
    {
      "path": "solution/run_search.py",
      "sha256": "7fbd17f7a5f416ba6fe8600f94b13212b4cac620b4079d8535bc22c32ee4b4e9"
    },
    {
      "path": "solution/search_policy.py",
      "sha256": "01132dbcb1e27108170932c3176b9d2bbb3231723300b9bb9f442c3a60e41fc0"
    },
    {
      "path": "solution/solve.sh",
      "sha256": "33f12b878b38cbc630c24b0cf165f840bde2f8699a3826960d62e0d5b46e2f81"
    },
    {
      "path": "solution/solve_alt.sh",
      "sha256": "2b601caa484d620061b6277135a8d73c6b2e24f43b1f215f1ae558b36325d90c"
    },
    {
      "path": "tests/README.md",
      "sha256": "3aab8f8a19edc0c244f1d2979170d17f9c957e35f178ab6a7c5a3b89743530a9"
    },
    {
      "path": "tests/test.sh",
      "sha256": "b05422739733209471645b7ed75f337f77fa52a963650232262deac0852a3a3e"
    },
    {
      "path": "tests/test_analysis.py",
      "sha256": "496a9a9d10404f2c81cbf6f6ad6ab5ed9783c09afd091fe8ba4bd9a626f8d9d6"
    },
    {
      "path": "tests/test_outputs.py",
      "sha256": "7f5223184f8a6667f0955b64991e2a549265e40796130effbbec6894358809be"
    },
    {
      "path": "tests/verifier.py",
      "sha256": "1ccf14a871fa99549e0639c9f764711d66d2dbee53d3cab94b0758ac6198bad1"
    }
  ]
}
