{
  "schema_version": "1",
  "case_id": "032-matclaw-cips-curie-temperature",
  "state": "constructed",
  "evaluator_bundle_sha256": "4a4563c0ad2fe770979b51e218275d9eae881900a05fe27fc5646810e0440edb",
  "bundle_sha256": "4a4563c0ad2fe770979b51e218275d9eae881900a05fe27fc5646810e0440edb",
  "files": [
    {
      "path": "profiles/formal.yaml",
      "sha256": "d22c1326fd72b09f66a7f287e2b32cfa54cea7dcba85198b4364a9f4d0e75ded"
    },
    {
      "path": "profiles/platform.yaml",
      "sha256": "5e87e6b4252be48c39afedae1ac8cfb5b1875dc5113805c955b9f78e40d3d8e4"
    },
    {
      "path": "profiles/resource.yaml",
      "sha256": "c79596681d1453e07606251d34b1e6efcbf84c6e4eae251e0aa89c1f75cced30"
    },
    {
      "path": "profiles/smoke.yaml",
      "sha256": "20673db01c10f5a9b6d588776697342b830da96b2ab1757bd5e6cae0776fd7fd"
    },
    {
      "path": "reference/compute-runtime.lock.json",
      "sha256": "7297cd1d08a13e99e03fd883dfaa4cb0aee707aa871de476da163c10755b97cd"
    },
    {
      "path": "reference/generate_reference.py",
      "sha256": "7857f9a06f271562370d665415f842d44264edb12d3fa3dae59be6be5c80d952"
    },
    {
      "path": "reference/original_reference.json",
      "sha256": "22ce13a8c2404a4d178aae16249547633250f3128c3aec74faff5343f9b7e86b"
    },
    {
      "path": "reference/source.lock.json",
      "sha256": "8342f9c42badfc6a6aa30a27fe8201fef02a6c481d66334c4b93ebafba1a31f3"
    },
    {
      "path": "solution/alt_curie.py",
      "sha256": "74d1bef99a7dbc30c4220e5cec80b151cd72039ae57e54e52ddce07f7938cfa1"
    },
    {
      "path": "solution/curie_utils.py",
      "sha256": "68a08ad2aebaf7fd63c1c89428d1c9fabec885b5a8daef368bf6bccab487ebb1"
    },
    {
      "path": "solution/run_curie.py",
      "sha256": "837d8c3a0472db288ac28f67663c4b9ae81e6ba11573a8001b2f119033ac8c03"
    },
    {
      "path": "solution/run_profiles.json",
      "sha256": "bb6a7347a47ad3d1de56d241b7a893f34cd558b8402d19f41fd3f765be6016c5"
    },
    {
      "path": "solution/solve.sh",
      "sha256": "0b3d9cff1a20d5b428fdc080274fb55ddc4c2fe21e7c4143c4e67262e71a32b1"
    },
    {
      "path": "solution/solve_alt.sh",
      "sha256": "45383518076ea3cf4d52c455febe59b1c8edb2289a75fdaf9c8f7b89c818dced"
    },
    {
      "path": "tests/README.md",
      "sha256": "5ed66669878b138807c9cd69c07a34a705d4152a0fe8c7263c8a2f4d746b44a5"
    },
    {
      "path": "tests/test.sh",
      "sha256": "f384af5785df8f5c06749044a346df3d8a09fc6f296e797d828cc463ae8bfc9e"
    },
    {
      "path": "tests/test_analysis.py",
      "sha256": "6517c9eb15dd654b86b3e5d302bb256fdc926975445cdeb6310977b356ae8178"
    },
    {
      "path": "tests/test_outputs.py",
      "sha256": "f87483d623292e5dae9de983c9ff3ae587686ab215d476d7c8908114e8b98a27"
    },
    {
      "path": "tests/test_restartable.py",
      "sha256": "6a2386e3cab8db3a14f7152266a1b2f2732877fced8381e3be33bc219d3fb55b"
    },
    {
      "path": "tests/verifier.py",
      "sha256": "33295cd6d467a657ceba87bdd4150168c9b24e4fc21d00997cde9a1887ddf786"
    }
  ]
}
